{
  "$schema": "../../../schemas/migration-record.schema.json",
  "id": "migration.legacy-11",
  "source": { "provider": "example-tracker", "itemId": "LEGACY-11", "status": "Closed", "url": null },
  "classification": "historical",
  "disposition": "preserve",
  "targetStatus": null,
  "statusRationale": "The item is not required for active authority, dependency, or evidence.",
  "intentRefs": [],
  "relationshipRefs": [],
  "provenance": "missing",
  "evidenceGaps": ["completion evidence not retained"],
  "decision": "accepted",
  "notes": "Preserve source identity and status without manufacturing maturity."
}
